<?xml version="1.0" encoding="UTF-8"?>
<highlighter xmlns="http://www.script-solution.de/schemas/bs/bbc/language"
	xmlns:xsi="http://www.w3.org/2001/XMLSchema-instance"
	xsi:schemaLocation="http://www.script-solution.de/schemas/bs/bbc/language language.xsd">
	<name>XML</name>
	<hlNumbers>false</hlNumbers>
	<escapeChar>\</escapeChar>
	<stringQuotes>
		<def id="2">&#039;</def>
		<def id="1">&quot;</def>
	</stringQuotes>
	<slComments>
	</slComments>
	<mlComments>
		<def id="1" start="&lt;!--" end="--&gt;"/>
	</mlComments>
	<symbols>
	</symbols>
	<regexps>
		<def id="1" pattern="([a-z_\-:]+)(=)" cs="0" group="1"/>
		<def id="2" pattern="(&lt;[\/?|(\?xml)]?[a-z0-9_\-:]*(\??&gt;)?)" cs="0" group="1"/>
		<def id="3" pattern="(([\/|\?])?&gt;)" cs="0" group="1"/>
		<def id="4" pattern="&amp;.+?;"/>
	</regexps>
	<keywords>
	</keywords>
	<colors>
		<numbers>
		</numbers>
		<strings id="2">
			<attr name="fontColor" value="#FF00FF"/>
		</strings>
		<strings id="1">
			<attr name="fontColor" value="#FF00FF"/>
		</strings>
		<mlComments id="1">
			<attr name="fontColor" value="#0000FF"/>
		</mlComments>
		<regexp id="1">
			<attr name="fontColor" value="#6a5ada"/>
		</regexp>
		<regexp id="2">
			<attr name="fontColor" value="#008a8c"/>
		</regexp>
		<regexp id="3">
			<attr name="fontColor" value="#008a8c"/>
		</regexp>
		<regexp id="4">
			<attr name="fontColor" value="#a04bf8"/>
		</regexp>
	</colors>
</highlighter>
