<?xml version="1.0" encoding="UTF-8"?>
<highlighter xmlns="http://www.script-solution.de/schemas/bs/bbc/language"
	xmlns:xsi="http://www.w3.org/2001/XMLSchema-instance"
	xsi:schemaLocation="http://www.script-solution.de/schemas/bs/bbc/language language.xsd">
	<name>Bash</name>
	<hlNumbers>true</hlNumbers>
	<escapeChar>\</escapeChar>
	<stringQuotes>
		<def id="2">&quot;</def>
		<def id="1">&#039;</def>
	</stringQuotes>
	<slComments>
		<def id="1">#</def>
	</slComments>
	<mlComments>
	</mlComments>
	<symbols>
		<kw>(</kw>
		<kw>)</kw>
		<kw>[</kw>
		<kw>]</kw>
		<kw>!</kw>
		<kw>@</kw>
		<kw>%</kw>
		<kw>&amp;</kw>
		<kw>*</kw>
		<kw>|</kw>
		<kw>/</kw>
		<kw>&gt;</kw>
		<kw>&lt;</kw>
		<kw>;;</kw>
	</symbols>
	<regexps>
		<def id="1" pattern="\$\{[a-zA-Z_][a-zA-Z0-9_]*?\}" cs="0"/>
		<def id="2" pattern="\$[a-zA-Z_][a-zA-Z0-9_]*" cs="0"/>
		<def id="3" pattern="([a-zA-Z_][a-zA-Z0-9_]*)=" cs="0"/>
		<def id="4" pattern="(?&lt;!\$)#[^\n]*" cs="0"/>
		<def id="5" pattern="\$#" cs="0"/>
	</regexps>
	<keywords>
		<def id="2" cs="false">
			<kw>aclocal</kw>
			<kw>aconnect</kw>
			<kw>aplay</kw>
			<kw>apm</kw>
			<kw>apmsleep</kw>
			<kw>apropos</kw>
			<kw>ar</kw>
			<kw>arch</kw>
			<kw>arecord</kw>
			<kw>as</kw>
			<kw>as86</kw>
			<kw>autoconf</kw>
			<kw>autoheader</kw>
			<kw>automake</kw>
			<kw>awk</kw>
			<kw>basename</kw>
			<kw>bc</kw>
			<kw>bison</kw>
			<kw>bunzip2</kw>
			<kw>bzip2</kw>
			<kw>bzcat</kw>
			<kw>bzcmp</kw>
			<kw>bzdiff</kw>
			<kw>bzegrep</kw>
			<kw>bzegrep</kw>
			<kw>bzfgrep</kw>
			<kw>bzgrep</kw>
			<kw>bzip2</kw>
			<kw>bzip2recover</kw>
			<kw>bzless</kw>
			<kw>bzmore</kw>
			<kw>c++</kw>
			<kw>cal</kw>
			<kw>cat</kw>
			<kw>chattr</kw>
			<kw>cc</kw>
			<kw>cdda2wav</kw>
			<kw>cdparanoia</kw>
			<kw>cdrdao</kw>
			<kw>cd-read</kw>
			<kw>cdrecord</kw>
			<kw>chfn</kw>
			<kw>chgrp</kw>
			<kw>chmod</kw>
			<kw>chown</kw>
			<kw>chroot</kw>
			<kw>chsh</kw>
			<kw>chvt</kw>
			<kw>clear</kw>
			<kw>cmp</kw>
			<kw>comm</kw>
			<kw>co</kw>
			<kw>col</kw>
			<kw>cp</kw>
			<kw>cpio</kw>
			<kw>cpp</kw>
			<kw>cut</kw>
			<kw>date</kw>
			<kw>dd</kw>
			<kw>dc</kw>
			<kw>dcop</kw>
			<kw>deallocvt</kw>
			<kw>df</kw>
			<kw>diff</kw>
			<kw>diff3</kw>
			<kw>dir</kw>
			<kw>dircolors</kw>
			<kw>directomatic</kw>
			<kw>dirname</kw>
			<kw>dmesg</kw>
			<kw>dnsdomainname</kw>
			<kw>domainname</kw>
			<kw>du</kw>
			<kw>dumpkeys</kw>
			<kw>ed</kw>
			<kw>egrep</kw>
			<kw>env</kw>
			<kw>expr</kw>
			<kw>false</kw>
			<kw>fbset</kw>
			<kw>fgconsole</kw>
			<kw>fgrep</kw>
			<kw>find</kw>
			<kw>file</kw>
			<kw>flex</kw>
			<kw>flex++</kw>
			<kw>fmt</kw>
			<kw>free</kw>
			<kw>ftp</kw>
			<kw>funzip</kw>
			<kw>fuser</kw>
			<kw>g++</kw>
			<kw>gawk</kw>
			<kw>gc</kw>
			<kw>gcc</kw>
			<kw>gdb</kw>
			<kw>getent</kw>
			<kw>getkeycodes</kw>
			<kw>getopt</kw>
			<kw>gettext</kw>
			<kw>gettextize</kw>
			<kw>gimp</kw>
			<kw>gimp-remote</kw>
			<kw>gimptool</kw>
			<kw>gmake</kw>
			<kw>gocr</kw>
			<kw>grep</kw>
			<kw>groups</kw>
			<kw>gs</kw>
			<kw>gunzip</kw>
			<kw>gzexe</kw>
			<kw>gzip</kw>
			<kw>head</kw>
			<kw>hexdump</kw>
			<kw>hostname</kw>
			<kw>id</kw>
			<kw>igawk</kw>
			<kw>install</kw>
			<kw>join</kw>
			<kw>kbd_mode</kw>
			<kw>kbdrate</kw>
			<kw>kdialog</kw>
			<kw>kfile</kw>
			<kw>kill</kw>
			<kw>killall</kw>
			<kw>last</kw>
			<kw>lastb</kw>
			<kw>ld</kw>
			<kw>ld86</kw>
			<kw>ldd</kw>
			<kw>less</kw>
			<kw>lex</kw>
			<kw>link</kw>
			<kw>ln</kw>
			<kw>loadkeys</kw>
			<kw>loadunimap</kw>
			<kw>locate</kw>
			<kw>lockfile</kw>
			<kw>login</kw>
			<kw>logname</kw>
			<kw>lp</kw>
			<kw>lpr</kw>
			<kw>ls</kw>
			<kw>lsattr</kw>
			<kw>lsmod</kw>
			<kw>lsmod.old</kw>
			<kw>lynx</kw>
			<kw>m4</kw>
			<kw>make</kw>
			<kw>man</kw>
			<kw>mapscrn</kw>
			<kw>mesg</kw>
			<kw>mkdir</kw>
			<kw>mkfifo</kw>
			<kw>mknod</kw>
			<kw>mktemp</kw>
			<kw>more</kw>
			<kw>mount</kw>
			<kw>msgfmt</kw>
			<kw>mv</kw>
			<kw>namei</kw>
			<kw>nano</kw>
			<kw>nasm</kw>
			<kw>nawk</kw>
			<kw>netstat</kw>
			<kw>nice</kw>
			<kw>nisdomainname</kw>
			<kw>nl</kw>
			<kw>nm</kw>
			<kw>nm86</kw>
			<kw>nmap</kw>
			<kw>nohup</kw>
			<kw>nop</kw>
			<kw>od</kw>
			<kw>openvt</kw>
			<kw>passwd</kw>
			<kw>patch</kw>
			<kw>pcregrep</kw>
			<kw>pcretest</kw>
			<kw>perl</kw>
			<kw>perror</kw>
			<kw>pgawk</kw>
			<kw>pidof</kw>
			<kw>ping</kw>
			<kw>pr</kw>
			<kw>procmail</kw>
			<kw>prune</kw>
			<kw>ps</kw>
			<kw>pstree</kw>
			<kw>ps2ascii</kw>
			<kw>ps2epsi</kw>
			<kw>ps2frag</kw>
			<kw>ps2pdf</kw>
			<kw>ps2ps</kw>
			<kw>psbook</kw>
			<kw>psmerge</kw>
			<kw>psnup</kw>
			<kw>psresize</kw>
			<kw>psselect</kw>
			<kw>pstops</kw>
			<kw>rbash</kw>
			<kw>rcs</kw>
			<kw>read</kw>
			<kw>readlink</kw>
			<kw>red</kw>
			<kw>resizecons</kw>
			<kw>rev</kw>
			<kw>rm</kw>
			<kw>rmdir</kw>
			<kw>run-parts</kw>
			<kw>sash</kw>
			<kw>sed</kw>
			<kw>setfont</kw>
			<kw>setkeycodes</kw>
			<kw>setleds</kw>
			<kw>setmetamode</kw>
			<kw>setserial</kw>
			<kw>scp</kw>
			<kw>seq</kw>
			<kw>setterm</kw>
			<kw>sh</kw>
			<kw>showkey</kw>
			<kw>shred</kw>
			<kw>size</kw>
			<kw>size86</kw>
			<kw>skill</kw>
			<kw>sleep</kw>
			<kw>slogin</kw>
			<kw>snice</kw>
			<kw>sort</kw>
			<kw>sox</kw>
			<kw>split</kw>
			<kw>ssed</kw>
			<kw>ssh</kw>
			<kw>ssh-add</kw>
			<kw>ssh-agent</kw>
			<kw>ssh-keygen</kw>
			<kw>ssh-keyscan</kw>
			<kw>stat</kw>
			<kw>strings</kw>
			<kw>strip</kw>
			<kw>stty</kw>
			<kw>su</kw>
			<kw>sudo</kw>
			<kw>suidperl</kw>
			<kw>sum</kw>
			<kw>sync</kw>
			<kw>tac</kw>
			<kw>tail</kw>
			<kw>tar</kw>
			<kw>tee</kw>
			<kw>tempfile</kw>
			<kw>touch</kw>
			<kw>tr</kw>
			<kw>true</kw>
			<kw>umount</kw>
			<kw>uname</kw>
			<kw>unicode_start</kw>
			<kw>unicode_stop</kw>
			<kw>uniq</kw>
			<kw>unlink</kw>
			<kw>unzip</kw>
			<kw>updatedb</kw>
			<kw>updmap</kw>
			<kw>uptime</kw>
			<kw>users</kw>
			<kw>utmpdump</kw>
			<kw>uuidgen</kw>
			<kw>vdir</kw>
			<kw>vmstat</kw>
			<kw>w</kw>
			<kw>wall</kw>
			<kw>wc</kw>
			<kw>wget</kw>
			<kw>whatis</kw>
			<kw>whereis</kw>
			<kw>which</kw>
			<kw>who</kw>
			<kw>whoami</kw>
			<kw>write</kw>
			<kw>xargs</kw>
			<kw>xhost</kw>
			<kw>xmodmap</kw>
			<kw>xset</kw>
			<kw>yacc</kw>
			<kw>yes</kw>
			<kw>ypdomainname</kw>
			<kw>zcat</kw>
			<kw>zcmp</kw>
			<kw>zdiff</kw>
			<kw>zegrep</kw>
			<kw>zfgrep</kw>
			<kw>zforce</kw>
			<kw>zgrep</kw>
			<kw>zip</kw>
			<kw>zless</kw>
			<kw>zmore</kw>
			<kw>znew</kw>
			<kw>zsh</kw>
			<kw>zsoelim</kw>
		</def>
		<def id="1" cs="false">
			<kw>case</kw>
			<kw>do</kw>
			<kw>done</kw>
			<kw>elif</kw>
			<kw>else</kw>
			<kw>esac</kw>
			<kw>fi</kw>
			<kw>for</kw>
			<kw>function</kw>
			<kw>if</kw>
			<kw>in</kw>
			<kw>select</kw>
			<kw>set</kw>
			<kw>then</kw>
			<kw>until</kw>
			<kw>while</kw>
			<kw>time</kw>
		</def>
		<def id="3" cs="false">
			<kw>alias</kw>
			<kw>bg</kw>
			<kw>bind</kw>
			<kw>break</kw>
			<kw>builtin</kw>
			<kw>cd</kw>
			<kw>command</kw>
			<kw>compgen</kw>
			<kw>complete</kw>
			<kw>continue</kw>
			<kw>declare</kw>
			<kw>dirs</kw>
			<kw>disown</kw>
			<kw>echo</kw>
			<kw>enable</kw>
			<kw>eval</kw>
			<kw>exec</kw>
			<kw>exit</kw>
			<kw>export</kw>
			<kw>fc</kw>
			<kw>fg</kw>
			<kw>getopts</kw>
			<kw>hash</kw>
			<kw>help</kw>
			<kw>history</kw>
			<kw>jobs</kw>
			<kw>kill</kw>
			<kw>let</kw>
			<kw>local</kw>
			<kw>logout</kw>
			<kw>popd</kw>
			<kw>printf</kw>
			<kw>pushd</kw>
			<kw>pwd</kw>
			<kw>readonly</kw>
			<kw>return</kw>
			<kw>shift</kw>
			<kw>shopt</kw>
			<kw>source</kw>
			<kw>suspend</kw>
			<kw>test</kw>
			<kw>times</kw>
			<kw>trap</kw>
			<kw>type</kw>
			<kw>typeset</kw>
			<kw>ulimit</kw>
			<kw>umask</kw>
			<kw>unalias</kw>
			<kw>unset</kw>
			<kw>wait</kw>
		</def>
	</keywords>
	<colors>
		<numbers>
			<attr name="fontColor" value="#800080"/>
		</numbers>
		<strings id="2">
			<attr name="fontColor" value="#FF00FF"/>
		</strings>
		<strings id="1">
			<attr name="fontColor" value="#FF00FF"/>
		</strings>
		<slComments id="1">
			<attr name="fontColor" value="#0000ff"/>
			<attr name="italic" value="true"/>
		</slComments>
		<symbols>
			<attr name="fontColor" value="#000000"/>
			<attr name="bold" value="true"/>
		</symbols>
		<regexp id="1">
			<attr name="fontColor" value="#007800"/>
		</regexp>
		<regexp id="2">
			<attr name="fontColor" value="#007800"/>
		</regexp>
		<regexp id="3">
			<attr name="fontColor" value="#008A8C"/>
		</regexp>
		<regexp id="4">
			<attr name="fontColor" value="#0000ff"/>
			<attr name="italic" value="true"/>
		</regexp>
		<regexp id="5">
			<attr name="fontColor" value="#007800"/>
		</regexp>
		<keywords id="1">
			<attr name="fontColor" value="#A52A2A"/>
			<attr name="bold" value="true"/>
		</keywords>
		<keywords id="2">
			<attr name="fontColor" value="#A52A2A"/>
			<attr name="bold" value="true"/>
		</keywords>
		<keywords id="3">
			<attr name="fontColor" value="#A52A2A"/>
			<attr name="bold" value="true"/>
		</keywords>
	</colors>
</highlighter>