<?xml version="1.0" encoding="UTF-8"?>
<highlighter xmlns="http://www.script-solution.de/schemas/bs/bbc/language"
	xmlns:xsi="http://www.w3.org/2001/XMLSchema-instance"
	xsi:schemaLocation="http://www.script-solution.de/schemas/bs/bbc/language language.xsd">
	<name>Javascript</name>
	<hlNumbers>true</hlNumbers>
	<escapeChar>\</escapeChar>
	<stringQuotes>
		<def id="2">&quot;</def>
		<def id="1">&#039;</def>
	</stringQuotes>
	<slComments>
		<def id="1">//</def>
	</slComments>
	<mlComments>
		<def id="1" start="/*" end="*/"/>
	</mlComments>
	<symbols>
		<kw>!</kw>
		<kw>@</kw>
		<kw>&amp;</kw>
		<kw>%</kw>
		<kw>*</kw>
		<kw>(</kw>
		<kw>)</kw>
		<kw>/</kw>
		<kw>]</kw>
		<kw>}</kw>
		<kw>|</kw>
		<kw>{</kw>
		<kw>&gt;</kw>
		<kw>[</kw>
		<kw>&lt;</kw>
	</symbols>
	<regexps>
		<!--<def id="1" pattern="\/.*\/([igm]*)?"/>-->
	</regexps>
	<keywords>
		<def id="3" cs="false">
			<kw>home</kw>
			<kw>stop</kw>
			<kw>status</kw>
			<kw>scroll</kw>
			<kw>alert</kw>
			<kw>onunload</kw>
			<kw>navigate</kw>
			<kw>back</kw>
			<kw>onfocus</kw>
			<kw>blur</kw>
			<kw>print</kw>
			<kw>close</kw>
			<kw>onerror</kw>
			<kw>open</kw>
			<kw>onload</kw>
			<kw>forward</kw>
			<kw>onresize</kw>
			<kw>onblur</kw>
			<kw>name</kw>
			<kw>write</kw>
			<kw>focus</kw>
			<kw>prompt</kw>
			<kw>onmove</kw>
			<kw>confirm</kw>
		</def>
		<def id="2" cs="false">
			<kw>true</kw>
			<kw>void</kw>
			<kw>false</kw>
			<kw>null</kw>
		</def>
		<def id="1" cs="false">
			<kw>const</kw>
			<kw>for</kw>
			<kw>var</kw>
			<kw>package</kw>
			<kw>catch</kw>
			<kw>use</kw>
			<kw>switch</kw>
			<kw>finally</kw>
			<kw>private</kw>
			<kw>while</kw>
			<kw>function</kw>
			<kw>namespace</kw>
			<kw>super</kw>
			<kw>throw</kw>
			<kw>break</kw>
			<kw>protected</kw>
			<kw>if</kw>
			<kw>delete</kw>
			<kw>import</kw>
			<kw>do</kw>
			<kw>else</kw>
			<kw>typeof</kw>
			<kw>with</kw>
			<kw>export</kw>
			<kw>is</kw>
			<kw>extends</kw>
			<kw>eval</kw>
			<kw>return</kw>
			<kw>class</kw>
			<kw>as</kw>
			<kw>in</kw>
			<kw>new</kw>
			<kw>default</kw>
			<kw>instanceof</kw>
			<kw>continue</kw>
			<kw>item</kw>
			<kw>debugger</kw>
			<kw>case</kw>
			<kw>public</kw>
			<kw>this</kw>
			<kw>try</kw>
		</def>
	</keywords>
	<colors>
		<numbers>
			<attr name="fontColor" value="#000080"/>
		</numbers>
		<strings id="2">
			<attr name="fontColor" value="#FF00FF"/>
		</strings>
		<strings id="1">
			<attr name="fontColor" value="#FF00FF"/>
		</strings>
		<slComments id="1">
			<attr name="fontColor" value="#008000"/>
		</slComments>
		<mlComments id="1">
			<attr name="fontColor" value="#008000"/>
		</mlComments>
		<symbols>
			<attr name="fontColor" value="#800000"/>
		</symbols>
		<regexp id="1">
			<attr name="fontColor" value="#008080"/>
		</regexp>
		<keywords id="3">
			<attr name="fontColor" value="#FF0000"/>
		</keywords>
		<keywords id="2">
			<attr name="fontColor" value="#2E8B57"/>
			<attr name="bold" value="true"/>
		</keywords>
		<keywords id="1">
			<attr name="fontColor" value="#A52A2A"/>
			<attr name="bold" value="true"/>
		</keywords>
	</colors>
</highlighter>
